{"$schema":"https://json-schema.org/draft/2020-12/schema","title":"Self-scoring exam","type":"object","required":["schemaVersion","examId","examName","examType","version","formatVersion","updatedAt","isPublished","sections","categories"],"properties":{"schemaVersion":{"const":"1.0"},"examId":{"type":"string","pattern":"^[A-Za-z0-9_-]+$"},"examName":{"type":"string","minLength":1},"examType":{"enum":["ME2","NATIONAL","UNIFIED","OTHER"]},"version":{"type":"string"},"formatVersion":{"type":"string"},"updatedAt":{"type":"string","format":"date-time"},"isPublished":{"type":"boolean"},"availableFrom":{"type":["string","null"],"format":"date-time"},"availableUntil":{"type":["string","null"],"format":"date-time"},"sections":{"type":"array","minItems":1},"categories":{"type":"array","minItems":1,"items":{"type":"string"},"uniqueItems":true}}}
